{
  "grammar": "rfc3986-uri",
  "pruned": [
    "rfc3986-uri:ALPHA#af667a1d",
    "rfc3986-uri:HEXDIG#17ea24f6",
    "rfc3986-uri:HEXDIG#2f9f8932",
    "rfc3986-uri:HEXDIG#e694ac1d",
    "rfc3986-uri:URI-reference#0783e772",
    "rfc3986-uri:URI-reference#1bc432aa",
    "rfc3986-uri:URI-reference#952ccf53",
    "rfc3986-uri:URI-reference#b55032c5",
    "rfc3986-uri:absolute-URI#3c6e0606",
    "rfc3986-uri:absolute-URI#4fb7b4ad",
    "rfc3986-uri:absolute-URI#55015e88",
    "rfc3986-uri:absolute-URI#64f9fa40",
    "rfc3986-uri:absolute-URI#78d0e2c8",
    "rfc3986-uri:absolute-URI#7f23cf25",
    "rfc3986-uri:absolute-URI#ac37fc2a",
    "rfc3986-uri:absolute-URI#d4d96d85",
    "rfc3986-uri:absolute-URI#e47db922",
    "rfc3986-uri:dec-octet#0feb4668",
    "rfc3986-uri:dec-octet#139fb45e",
    "rfc3986-uri:dec-octet#42259534",
    "rfc3986-uri:dec-octet#822c0240",
    "rfc3986-uri:dec-octet#99c7dba2",
    "rfc3986-uri:dec-octet#a66d96b3",
    "rfc3986-uri:dec-octet#c2cf0de3",
    "rfc3986-uri:dec-octet#cab0a862",
    "rfc3986-uri:dec-octet#d77e0913",
    "rfc3986-uri:dec-octet#fa19df62",
    "rfc3986-uri:gen-delims#0bf9a02e",
    "rfc3986-uri:gen-delims#1c38855e",
    "rfc3986-uri:gen-delims#529d6e95",
    "rfc3986-uri:gen-delims#69bfdb56",
    "rfc3986-uri:gen-delims#8ed3d42b",
    "rfc3986-uri:gen-delims#aee23604",
    "rfc3986-uri:gen-delims#b5a7a9bd",
    "rfc3986-uri:gen-delims#ebd63865",
    "rfc3986-uri:gen-delims#f062a3c2",
    "rfc3986-uri:hier-part#84603568",
    "rfc3986-uri:hier-part#fcf49535",
    "rfc3986-uri:path#1b714f17",
    "rfc3986-uri:path#5cfcd61b",
    "rfc3986-uri:path#7876c724",
    "rfc3986-uri:path#a2c815c4",
    "rfc3986-uri:path#c73ce2aa",
    "rfc3986-uri:path#ee1420a2",
    "rfc3986-uri:path#ef8f3fec",
    "rfc3986-uri:path-absolute#122d93bc",
    "rfc3986-uri:path-absolute#4e87f57a",
    "rfc3986-uri:path-absolute#4f984ae7",
    "rfc3986-uri:path-absolute#751cb9b6",
    "rfc3986-uri:path-absolute#9b0ef576",
    "rfc3986-uri:path-absolute#a007ab6e",
    "rfc3986-uri:path-absolute#b544b7c6",
    "rfc3986-uri:path-absolute#b9d88362",
    "rfc3986-uri:path-absolute#bfa3a6a9",
    "rfc3986-uri:path-absolute#d8b7c876",
    "rfc3986-uri:path-absolute#e0dd2ab2",
    "rfc3986-uri:path-empty#31e57e34",
    "rfc3986-uri:path-empty#9046b230",
    "rfc3986-uri:path-empty#a0749f99",
    "rfc3986-uri:path-noscheme#01517d91",
    "rfc3986-uri:path-noscheme#06aa88f8",
    "rfc3986-uri:path-noscheme#1c05c307",
    "rfc3986-uri:path-noscheme#26cb9386",
    "rfc3986-uri:path-noscheme#37d33533",
    "rfc3986-uri:path-noscheme#b3146a7b",
    "rfc3986-uri:path-noscheme#becea0be",
    "rfc3986-uri:path-noscheme#fa47cfdb",
    "rfc3986-uri:path-rootless#08f47353",
    "rfc3986-uri:path-rootless#2a2a8ef7",
    "rfc3986-uri:path-rootless#aed05071",
    "rfc3986-uri:path-rootless#fa5d5a4f",
    "rfc3986-uri:query#7877c585",
    "rfc3986-uri:query#78b1a305",
    "rfc3986-uri:reg-name#e526df8e",
    "rfc3986-uri:relative-part#0058f539",
    "rfc3986-uri:relative-part#5efc757e",
    "rfc3986-uri:relative-part#8b49da89",
    "rfc3986-uri:relative-part#8badb4cc",
    "rfc3986-uri:relative-part#c9353f91",
    "rfc3986-uri:relative-part#cca1fb03",
    "rfc3986-uri:relative-part#e076ec87",
    "rfc3986-uri:relative-part#ef25c448",
    "rfc3986-uri:relative-part#f766dcd1",
    "rfc3986-uri:relative-ref#13958a7e",
    "rfc3986-uri:relative-ref#51dc7553",
    "rfc3986-uri:relative-ref#70c80f4f",
    "rfc3986-uri:relative-ref#72af9898",
    "rfc3986-uri:relative-ref#ba09c7c1",
    "rfc3986-uri:relative-ref#c637cf19",
    "rfc3986-uri:reserved#20927a34",
    "rfc3986-uri:reserved#2bb4e402",
    "rfc3986-uri:reserved#f408c937",
    "rfc3986-uri:reserved#f89f1e25",
    "rfc3986-uri:scheme#4962bdcd",
    "rfc3986-uri:scheme#872a533b",
    "rfc3986-uri:segment-nz-nc#07192340",
    "rfc3986-uri:segment-nz-nc#3be0e142",
    "rfc3986-uri:segment-nz-nc#8be8aa44",
    "rfc3986-uri:segment-nz-nc#9a616507",
    "rfc3986-uri:sub-delims#05eb1c6f",
    "rfc3986-uri:sub-delims#21903ace",
    "rfc3986-uri:sub-delims#5bfba425",
    "rfc3986-uri:sub-delims#5f5b50ba",
    "rfc3986-uri:sub-delims#66addaef",
    "rfc3986-uri:sub-delims#afe23b2d",
    "rfc3986-uri:sub-delims#c3585fcc",
    "rfc3986-uri:sub-delims#e1482266",
    "rfc3986-uri:unreserved#0e884de7",
    "rfc3986-uri:unreserved#2bf9948f"
  ],
  "schema_version": 1,
  "surviving_grammar": "mvs/rfc3986-uri.mvs.abnf",
  "threshold": 0.001
}
